{
  "schema_version": 1,
  "test_run_id": "ci-performance-summarizer-001",
  "hardware_profile_id": "fixture-win11-x64",
  "sample_rate_hz": 48000,
  "frame_duration_ms": 10,
  "measurement_window_seconds": 30.0,
  "processed_path_latency_ms": [
    10, 11, 12, 13, 14, 15, 16, 17, 18, 19,
    20, 21, 22, 23, 24, 25, 26, 27, 28, 29
  ],
  "callback_jitter_ms": [
    0.1, 0.2, 0.3, 0.4, 0.5, 0.6, 0.7, 0.8, 0.9, 1.0,
    1.1, 1.2, 1.3, 1.4, 1.5, 1.6, 1.7, 1.8, 1.9, 2.0
  ],
  "safe_bypass_transition_ms": [
    100, 101, 102, 103, 104, 105, 106, 107, 108, 109,
    110, 111, 112, 113, 114, 115, 116, 117, 118, 119
  ],
  "provider_path": "not_applicable",
  "network_profile": "not_applicable"
}
